{
  "schemaVersion": "five-layer-workload.v2",
  "numberOfDevices": 100,
  "deviceSendingIntervalInMinutes": 2.0,
  "averageSizeOfMessageInKb": 0.25,
  "numberOfDeviceTypes": 1,
  "hotStorageDurationInMonths": 1,
  "coolStorageDurationInMonths": 3,
  "archiveStorageDurationInMonths": 12,
  "twinEntityCount": 100,
  "aggregateDashboardRefreshesPerHour": 12,
  "apiCallsPerAggregateDashboardRefresh": 1,
  "dashboardActiveHoursPerDay": 1,
  "monthlyEditorSeats": 2,
  "monthlyViewerSeats": 1,
  "twinStateMaterializationsPerSecond": 0.1,
  "twinGraphUpdatesPerSecond": 0.01,
  "eventingScenarioId": "eventing-small-v1",
  "currency": "USD"
}
